"timestamp","user","tone","original","rewritten","evaluation"

2025-07-04 03:39:06.677223,Elon,Luxury & Premium,One of the bad product experiences ever. Want a refund.,"Undeniably, this has been one of the less satisfactory product experiences I have encountered. I would appreciate the initiation of a refund process.","Clarity: 5 - The reviewer clearly states their dissatisfaction with the product and their desire for a refund. 

Tone Fit: 4 - The language used is formal and polite, which is suitable for a premium home brand. However, the lack of specific details about the product or the issues encountered might seem somewhat detached for a premium brand that values customer feedback.

Helpfulness: 2 - While the reviewer expresses dissatisfaction, they do not provide specific information about what was unsatisfactory about the product. This lack of detail makes the review less helpful for both the company and other potential customers."
2025-07-04 03:40:40.226927,Elon,Warm & Friendly,This chair is alright but the legs feel wobbly and it was hard to put together.,"The chair has its charm, however, I did encounter a bit of a challenge with the assembly and noticed the legs could use a touch more stability.","Clarity: 5 - The reviewer is clear about their experience with the product. They mention that they had a challenge with assembly and found the chair legs to be unstable.

Tone Fit: 4 - The reviewer maintains a respectful and neutral tone, which is fitting for a premium home brand. However, the language is a bit casual, which may not perfectly fit with a premium brand.

Helpfulness: 4 - The review provides useful information that could help potential buyers make a decision. However, it could have been more helpful if the reviewer had provided more details about the assembly issue and the stability of the chair legs."
2025-07-04 20:39:58.438051,elon,Warm & Friendly,The lamp looked better online. In person it’s super flimsy and cheap looking. Not worth it.,"""While the lamp displayed online had a certain charming allure, it did feel a tad delicate and somewhat less luxurious in person. It's worth considering if this style aligns with your expectations before purchasing.""","- Clarity: 3/5. The review starts off clear with a straightforward opinion about the product, but the latter part includes a lot of technical details and jargon that are not easy to understand for a general reader. It appears to be some sort of metadata or system log.
- Tone Fit to premium brand: 4/5. The language used in the review (e.g. ""charming"", ""delicate"", ""luxurious"") fits well with a premium brand. However, the technical details in the latter part of the review do not fit a premium brand's tone.
- Empathy: 4/5. The reviewer is empathetic in their suggestion to other consumers to consider whether the style of the lamp aligns with their expectations. They are not overly critical but provide a balanced view.
- Brand Voice Consistency: 2/5. While the initial part of the review is consistent with a premium brand's voice, the latter part with technical details does not reflect a brand voice at all. It seems like there has been a mix-up with the review text and some backend system information."
2025-07-04 20:45:28.182922,elon,Warm & Friendly,The lamp looked better online. In person it’s super flimsy and cheap looking. Not worth it.,"""While the lamp's online presentation captured my attention, I found it to be somewhat delicate and less robust than anticipated upon receiving it. Thus, I felt the value didn't quite meet my expectations. I share this feedback from my personal experience to assist other potential buyers in making an informed decision.""","- Clarity: 4
The customer clearly communicates their dissatisfaction with the product's delicacy and the perceived lack of value. However, the inclusion of irrelevant metadata makes the review confusing.

- Tone Fit to premium brand: 5
The review is written in a polite, formal tone that is appropriate for a premium brand. The customer expresses their dissatisfaction without using harsh or offensive language.

- Empathy: 3
The review expresses the customer's personal experience and disappointment, which may resonate with other customers. However, it does not actively show understanding or concern for other customers' experiences.

- Brand Voice Consistency: 1
The review includes a large amount of irrelevant metadata, which disrupts the consistency of the brand voice. Without this metadata, the review could fit well with a brand that values honest, constructive feedback."
2025-07-04 20:46:20.071471,elon,Warm & Friendly,The lamp looked better online. In person it’s super flimsy and cheap looking. Not worth it.,"""While the lamp appeared more enticing in the online imagery, in reality, it presented a somewhat different impression. The lamp felt more lightweight and less substantial than expected, which may not align with everyone's tastes. Despite this, it is important to note that preferences can greatly vary.""","- Clarity: 1/5
The review is unclear and confusing. It seems to be mixed with system data and variables, which makes it difficult to understand the customer's feedback.

- Tone Fit to premium brand: 1/5
The tone of the review does not fit to a premium brand. The language is not sophisticated or professional and it's hard to discern any tone due to the jumbled nature of the message.

- Empathy: 1/5
There is no empathy shown in the review. The customer's feelings or experiences with the product are not clearly conveyed due to the complex nature of the message.

- Brand Voice Consistency: 1/5
The review does not maintain a consistent brand voice. It's hard to even identify a brand voice within this review due to the presence of irrelevant system data.

The review seems to contain pieces of a potentially valid review (""While the lamp appeared more appealing in the online imagery, in reality, it felt somewhat more lightweight and less substantial than expected."") but is overwhelmingly dominated by what appears to be system information or coding language. This makes it hard to evaluate on all four criteria."
2025-07-04 20:46:50.208368,elon,Warm & Friendly,The lamp looked better online. In person it’s super flimsy and cheap looking. Not worth it.,"""While the lamp may seem quite charming in its online portrayal, in person, it presents itself with a more delicate and less sophisticated touch than expected. From my viewpoint, I felt that the quality of the lamp may not completely justify its premium price tag. For potential buyers, I would recommend considering this factor while making a purchasing decision. Please note that this is just my own observation and different individuals might perceive it differently.""","- Clarity: 4
The review is fairly clear, although some of the technical jargon and metadata could be confusing to a layperson. The customer's dissatisfaction with the product is clearly communicated.

- Tone fit to premium brand: 3
The tone of the review is polite and respectful, but it doesn't quite embody the sophistication commonly associated with a premium brand. 

- Empathy: 2
The reviewer could have shown more empathy towards other potential buyers by explaining more in detail about the specific aspects they found subpar with the product.

- Brand Voice Consistency: 1
The review includes a lot of technical language and metadata that is inconsistent with a typical brand voice. This could be disorienting for some customers."
2025-07-04 20:47:15.884674,elon,Warm & Friendly,The lamp looked better online. In person it’s super flimsy and cheap looking. Not worth it.,"""While the online portrayal of the lamp was positively enchanting, the real-life experience didn't quite meet the promise. The lamp felt somewhat fragile and seemed to lack the anticipated high-end finish typical of this premium brand. From my personal viewpoint, the value didn't quite align with its price point. Nonetheless, this is merely my experience and others may find a different value perception.""","- Clarity: 5/5
The reviewer is clear in expressing their disappointment with the product they received. They specify that the lamp wasn't as aesthetically pleasing in person as it was online, felt delicate, and didn't have a premium finish.

- Tone Fit to premium brand: 5/5
The tone of the review is formal and well-articulated, which aligns well with a premium brand. The reviewer expresses their point of view in a polite and respectful manner.

- Empathy: 4/5
The reviewer does show some empathy by using phrases like ""Personally, I didn't find its value matched its price."" This shows they understand this is a subjective opinion and others might have a different experience.

- Brand Voice Consistency: 1/5
The review itself seems to be disconnected from the brand voice, as it's hard to discern any brand-specific language or tone from this review. It seems more like a general customer review rather than a representation of a specific brand's voice."
2025-07-04 20:47:45.168297,elon,Luxury & Premium,The lamp looked better online. In person it’s super flimsy and cheap looking. Not worth it.,"""The lamp, as presented in the online snapshots, seemed to exude an aura of superior elegance and quality. However, upon receiving and inspecting the product firsthand, I found the construction to be slightly lacking in the robustness and refinement I had anticipated. While the lamp still retains some of its charm, the overall value does not quite align with the investment I made. I share this with the hope that other discerning customers might benefit from my experience and that the brand continues to uphold its commitment to delivering premium quality.""","- Clarity: 5/5
The customer has explained their dissatisfaction clearly. They find the product's quality and construction to be inferior to what was projected in the online photos and feel it doesn't justify the price they paid.

- Tone Fit to premium brand: 4/5
The customer's tone is polite and their language is sophisticated, which fits well with a premium brand. However, their dissatisfaction may slightly impact the brand's premium image.

- Empathy: 2/5
While the customer's disappointment is clear, the review lacks a sense of shared experience or understanding, which is crucial for empathy.

- Brand Voice Consistency: 3/5
Assuming the brand voice to be sophisticated and premium, the review aligns well in terms of language use. However, it does not align with the brand's voice in terms of product quality and value. The reviewer is not satisfied with the product they received, which contrasts with the high quality usually associated with a premium brand."
2025-07-04 20:49:19.756859,elon,Luxury & Premium,The lamp looked better online. In person it’s super flimsy and cheap looking. Not worth it.,"""While the lamp's digital presentation was quite appealing, the actual product fell short of my expectations. It seems to possess a certain delicacy and lacks the robust sumptuousness one might hope for from such a premium brand. Regrettably, the price point seems a bit steep considering the product's quality. Although I am disappointed, I understand that there could be various factors affecting the product's quality, such as manufacturing or shipping. I look forward to seeing improvements in future products from this premium home goods brand.""","- Clarity: 4
The review is largely clear, with the customer making it evident that they found the physical product to not meet their expectations from the digital presentation. They express dissatisfaction with the product's quality and its price. The excess technical data is not relevant to the review and may cause some confusion, but the primary message is clear.

- Tone Fit to Premium Brand: 5
The customer uses language that is appropriate for discussing a premium brand. Phrases like ""certain delicacy"" and ""robust sumptuousness"" are fitting for a high-end product and the customer's expectations of such.

- Empathy: 2
The review lacks empathy, as the customer doesn't show understanding towards the brand. They simply express their disappointment without considering any potential reasons for the product's perceived shortcomings.

- Brand Voice Consistency: 1
This score is low due to the inclusion of irrelevant technical data which breaks the consistency of the brand voice. If we only consider the actual review, it is consistent with a premium brand's voice. However, the technical data gives the impression of a software or tech brand, which is inconsistent with a premium home goods brand that sells lamps."
2025-07-04 20:49:43.836981,elon,Luxury & Premium,The lamp looked better online. In person it’s super flimsy and cheap looking. Not worth it.,"""The image of the lamp presented digitally seemed to be of superior quality. However, upon a closer look, I found it to be lacking in durability and not as aesthetically pleasing as I initially thought. It did not meet my expectations in terms of its visual appeal and overall value. Unfortunately, it does not align with the high standards I associate with this premium brand.""","- Clarity: 2/5
The review starts clear but then veers into a lot of technical jargon that is not related to the product review. The customer's opinion on the product gets lost in all the additional information. 

- Tone Fit to premium brand: 4/5
The initial part of the review uses a polished and sophisticated language, which fits a premium brand. However, the latter part of the review seems to be filled with unnecessary coding jargon, which doesn't fit the tone.

- Empathy: 2/5
The customer expresses dissatisfaction with the product, which shows some level of empathy. However, the latter part of the review is filled with unrelated technical details, which makes it hard to understand the customer's emotional state.

- Brand Voice Consistency: 1/5
The review doesn't maintain consistency in brand voice. The initial part of the review sounds professional and fitting for a premium brand. The latter part, however, is filled with technical jargon that doesn't uphold the brand's voice."
2025-07-04 20:50:21.196720,elon,Warm & Friendly,Love the mattress overall but it came with a weird smell that took a few days to go away.,"""We're delighted to hear that you love your new mattress! We recognize that it might have had an unusual scent upon its arrival, which is expected to dissipate in a few days. We value your patience and understanding in this regard, and hope that you continue to enjoy your restful sleep.""","- Clarity: 4
The review is generally clear, however, there is too much unnecessary metadata that makes it a bit confusing. The actual review text is easily understandable and well-worded.

- Tone Fit to premium brand: 4
The tone used is generally professional and fits well with a premium brand. However, the use of the word 'peculiar' could potentially be seen as negative.

- Empathy: 5
There is a clear understanding and acknowledgement of the customer's experience (the unusual scent of the new mattress), and the brand expresses appreciation for the customer's patience and understanding, which shows empathy.

- Brand Voice Consistency: 3
The brand voice is generally professional, but it's difficult to determine consistency without more context or examples of the brand's usual communication style. The presence of the technical metadata also disrupts the flow of the brand voice."
2025-07-04 20:52:21.643611,elon,Helpful & Technical,The lamp looked better online. In person it’s super flimsy and cheap looking. Not worth it.,"""Upon unboxing the lamp, it becomes evident that the online images may not fully capture the tangible aspects of the product. Some customers have shared feedback that the lamp feels somewhat lightweight and not as sturdy as they had anticipated. As a premium brand, we continually strive for ultimate customer satisfaction. However, we recognize that the perceived value may not align with everyone's expectations. We take this feedback seriously and appreciate it as it helps us to enhance our product offerings and meet our customers' high standards.""","- Clarity: 2
The review is not very clear because it contains a lot of unnecessary technical details, codes, and metadata which make it difficult to understand the actual customer feedback about the product. The points about the lamp's weight and robustness are buried in the clutter.

- Tone Fit to premium brand: 4
Despite the irrelevant information, the reviewer uses language that is fitting to a premium brand. They use phrases like ""strive to ensure ultimate satisfaction,"" which is appropriate for high-end businesses.

- Empathy: 3
The reviewer acknowledges that the perceived value of the product may not meet everyone's expectations. However, the empathy is not clearly communicated due to the unnecessary technical data included in the review.

- Brand Voice Consistency: 1
The inclusion of system codes and metadata detracts from the brand voice consistency. While there are some elements of a premium brand voice, such as seeking to ensure customer satisfaction, these are overshadowed by the technical jargon."
2025-07-04 21:02:03.856137,elon,Warm & Friendly,OMG this couch is everything!!! So comfy and looks great in my apartment.,"""Wow! This sofa truly has it all! Its comfort is unparalleled and it adds such a stunning aesthetic to my apartment. The plush cushions and the sleek design are what make this piece a must-have for any discerning homeowner. It's not just a sofa, it's a statement. This premium brand truly delivers on its promise of superior quality and exceptional design. I couldn't be happier with this purchase and I fully recommend it to others seeking luxury and comfort in their living spaces.""","- Clarity: 2/5
The review starts off clearly with the customer expressing satisfaction with the sofa's comfort and aesthetics. However, the rest of the review contains a lot of technical metadata which makes it hard to decipher the main message. It's not clear if this information is relevant or just filler.

- Tone Fit to premium brand: 3/5
The beginning of the review fits a premium brand's tone, using words like ""unparalleled"" and ""stunning aesthetic"". However, the technical metadata that follows doesn't fit the tone of a typical customer review for a premium brand.

- Empathy: 1/5
There is no evidence of empathy in this review. It is very factual and technical, with no emotional connection or understanding shown towards other potential customers or the brand itself.

- Brand Voice Consistency: 1/5
The review starts off with a consistent brand voice, praising the product in a way that aligns with a premium brand. However, the voice becomes inconsistent with the inclusion of the technical metadata, which is not typical in customer reviews and doesn't align with a premium brand's voice."
2025-07-04 21:03:48.152157,elon,Luxury & Premium,OMG this couch is everything!!! So comfy and looks great in my apartment.,"""Experiencing this sofa has been a transformative journey for me. The remarkable comfort it offers is perfectly aligned with its aesthetic appeal, elevating the ambiance of my residence. The sofa is not just a piece of furniture; it has become a haven of relaxation after a long day. It fits perfectly in my living room, adding a touch of elegance and sophistication that is hard to miss. It has truly turned my house into a home, and I am thrilled to share this experience with others who are seeking a perfect balance of comfort and style in their living spaces.""","- Clarity: 5/5. The customer's opinion about the sofa is very clear. They find it comfortable and aesthetically pleasing, and believe it enhances the ambiance of their residence.
- Tone Fit to premium brand: 4/5. The language used is eloquent and positive, fitting for a premium brand. However, the inclusion of metadata and coding language detracts from the overall premium feel.
- Empathy: 2/5. While the review is positive, it doesn't invite empathy or create a connection with other potential customers because it doesn't share any personal experiences or challenges the product helped overcome.
- Brand Voice Consistency: 1/5. Without knowledge of the exact brand voice, it's hard to evaluate this. However, the inclusion of unnecessary metadata and coding language is likely inconsistent with any brand's standard customer review. They make the review seem robotic and impersonal."
2025-07-04 21:05:30.683072,elon,Helpful & Technical,OMG this couch is everything!!! So comfy and looks great in my apartment.,"""I am absolutely delighted with this couch! It offers unparalleled comfort and visually enhances the overall ambiance of my apartment.""","- Clarity: 1/5
The review is quite unclear as it is embedded within a block of code. The actual review content, ""Absolutely delighted with this couch! It offers unparalleled comfort and visually enhances the overall ambiance of my apartment."" is clear and concise but it is difficult to understand due to the format it is presented in.

- Tone Fit to premium brand: 4/5
The customer uses phrases like ""absolutely delighted"" and ""unparalleled comfort"", which fit a premium brand well. However, the technical code surrounding the review detracts from the overall tone.

- Empathy: 2/5
The reviewer does express their personal feelings of delight and satisfaction with the product, but the empathy is lost amidst the technical jargon and code surrounding the review.

- Brand Voice Consistency: 1/5
The brand voice consistency cannot be properly evaluated due to the formatting of the review. The actual review content is positive and fits a premium brand voice, but the technical code surrounding it is not consistent with a typical customer review and detracts from the overall message."
2025-07-04 21:05:53.320650,elon,Luxury & Premium,OMG this couch is everything!!! So comfy and looks great in my apartment.,"""This exquisite couch is simply the epitome of luxury and comfort! It has effortlessly amplified the elegance of my apartment, offering unparalleled comfort. I believe it will address the needs of anyone seeking a blend of luxury and comfort in their living space. Despite my personal experience, I understand that everyone's needs are unique and this couch might serve different purposes for different individuals. However, I am confident that it will enhance any home with its exquisite design and ultimate comfort.""","- Clarity: 2/5
The review starts off clear, but the latter part seems to be filled with programming code or system-generated text which confuses the reader.

- Tone Fit to premium brand: 5/5
The tone is very positive and high-end, using words like ""exquisite"", ""epitome of luxury"", and ""amplified the elegance"", which perfectly fits a premium brand.

- Empathy: 1/5
The review doesn't show empathy. It's more about the customer's personal experience with the product and doesn't address any potential concerns or needs of other customers.

- Brand Voice Consistency: 1/5
While the initial review has a high-end tone, the inclusion of what appears to be system-generated text or programming code completely disrupts the brand voice. It's unclear how this relates to the product or brand."
2025-07-04 21:30:21.906883,elon,Warm & Friendly,OMG this couch is everything!!! So comfy and looks great in my apartment.,"""Wow! This sofa is truly a gem. Not only does it offer supreme comfort that will undoubtedly delight any sitter, but it also enhances the aesthetic appeal of my living space, adding a touch of elegance that resonates with the brand's promise of quality and sophistication. I believe that anyone looking for a blend of comfort and style would find this sofa to be a perfect choice.""","Clarity: 5/5. The reviewer clearly expresses their satisfaction with the sofa's comfort and aesthetic appeal.
Tone Fit to premium brand: 5/5. The enthusiastic tone and positive language align well with a premium brand.
Empathy: 3/5. The reviewer is expressing personal satisfaction, but not necessarily understanding or connecting with other potential buyers.
Brand Voice Consistency: 4/5. The reviewer's enthusiastic tone matches a positive brand voice, but without more context about the specific brand's voice, it's difficult to give a perfect score."
2025-07-04 21:30:43.567225,elon,Luxury & Premium,OMG this couch is everything!!! So comfy and looks great in my apartment.,"""Let me tell you, this sofa is the epitome of luxury! It exudes a comfort that is unmatched and adds an exquisite aesthetic appeal that has truly transformed my apartment. I understand the need for a piece that's not just appealing, but also delivers on comfort and quality. This sofa does exactly that. It's clear that this brand understands and caters to those seeking luxury and elegance in their home. The consistency in their high-quality and luxurious offerings is truly commendable.""","Clarity: 5/5. The review is straightforward and easy to understand.
Tone Fit to premium brand: 5/5. The reviewer uses words like ""luxury"" and ""exquisite"" which align with a premium brand tone.
Empathy: 2/5. While the review is positive, it does not express a strong connection to other potential customers or their needs.
Brand Voice Consistency: 3/5. The review is positive, however, it doesn't provide enough context to determine consistency with the brand voice."
